{
  "$schema": "../../schemas/governance/s0a-contract-materialization-crosswalk-v3.schema.json",
  "schema_version": "qme.s0a_contract_materialization_crosswalk.v3",
  "crosswalk_id": "NEE-172-S0A-2-CONTRACT-MATERIALIZATION-CROSSWALK-V3",
  "status": "OWNER_AMENDMENTS_REGISTERED_OPERATIONAL_V2_CONTRACTS_NOT_CREATED",
  "semantic_sha256": "e04c5ad8:41dc933c:a2ef5e47:73af4830:7a042260:6b2a1f24:d511db20:1185acc5",
  "authority": {
    "approval_assertion_status": "OWNER_APPROVED_PROTECTED_MAIN_REGISTRATION_NOT_CRYPTOGRAPHIC_SIGNATURE",
    "predecessor_crosswalk_v2": {
      "id": "NEE-172-S0A-1-CONTRACT-MATERIALIZATION-CROSSWALK-V2",
      "path": "configs/governance/s0a-contract-materialization-crosswalk-v2.json",
      "sha256": "11f1de4d:51816cad:7d958fe9:2946e18f:e968d9de:7537006e:00f80577:c11942d1",
      "semantic_sha256": "6ffb8e9c:05076941:68df0d5c:e5f94dbd:f8d49248:729319da:aa0efd23:91144f40",
      "manifest_path": "configs/governance/s0a-contract-materialization-crosswalk-v2.hashes.json",
      "manifest_sha256": "46e4c77b:16fbe273:80c1b609:1b29ed19:fab61a94:b14a73ba:dd7face8:49bbc84e",
      "protected_main_commit": "ece578ff:ac6f5b9f:8dbfd07c:5a09709f:21b5dbe4"
    },
    "owner_mandate_supplement_a0": {
      "id": "OWNER-MANDATE-2026-08-13-SUPPLEMENT-V1",
      "path": "configs/governance/owner-mandate-supplement-2026-08-13-v1.json",
      "sha256": "289aa1f5:5f586142:1730f146:611f42a1:10dab0a3:596294eb:4171b6dd:3acb5ee5",
      "semantic_sha256": "7756a720:fced47a4:4e4c5dfe:5f273c10:0d1bfc93:ac08b42b:590c03a0:f13e5c4a",
      "manifest_path": "configs/governance/owner-mandate-supplement-2026-08-13-v1.hashes.json",
      "manifest_sha256": "e5a7214d:1f686f7a:3966b487:30883a49:b7667e75:dc20a592:aa5d1f8d:c4861193",
      "approval_owner": "neeljaiswal90",
      "approval_date": "2026-08-13",
      "approved_at": null,
      "approved_at_status": "PERMANENTLY_UNAVAILABLE_NOT_INFERRED",
      "payload_representation": "NORMALIZED_SOURCE_FAITHFUL_MEANINGS_NOT_VERBATIM"
    },
    "protected_main_publication_receipt": {
      "status": "VERIFIED_PROTECTED_MAIN_EXACT_SHA_CI_PASS",
      "commit_sha": "23dd90ed:ae0eef5d:54e72996:faea6d98:f91bff2f",
      "tree_sha": "ae1eb49f:5d0e8ad9:798c9905:bf980a86:3349db18",
      "committer_timestamp": "2026-08-13T09:19:16-07:00",
      "ci_run_url": "https://github.com/neeljaiswal90/quant-stocks/actions/runs/31720071843",
      "ci_run_id": 31720071843,
      "ci_workflow": "qme-ci",
      "ci_job_name": "foundation",
      "ci_job_url": "https://github.com/neeljaiswal90/quant-stocks/actions/runs/31720071843/job/94514536421",
      "ci_head_sha": "23dd90ed:ae0eef5d:54e72996:faea6d98:f91bff2f",
      "ci_provider_conclusion": "success",
      "registered_conclusion": "PASS",
      "scope": "OWNER_MANDATE_SUPPLEMENT_A0_PUBLICATION_ONLY"
    }
  },
  "contract_targets": [
    {
      "ticket": "NEE-119",
      "current_path": "configs/quant/qme-v0.1-contract.json",
      "current_sha256": "47070e58:27292e74:567ae32a:eff58bcc:2c58e472:0edaa2d5:57435eb2:a5f472fa",
      "proposed_v2_path": "configs/quant/qme-v0.1-contract-v2.json",
      "identity_field": "contract_id",
      "current_identity": "qme-long-only-momentum-v0.1",
      "proposed_identity": "qme-long-only-momentum-v0.1",
      "proposed_identity_status": "PRESERVE_STABLE_STRATEGY_ID"
    },
    {
      "ticket": "NEE-120",
      "current_path": "configs/quant/economic-promotion-decision-v1.json",
      "current_sha256": "4857af12:6f6a010c:d598030e:90d868da:e19235c4:4450bf60:058a3e2a:aa3dec2a",
      "proposed_v2_path": "configs/quant/economic-promotion-decision-v2.json",
      "identity_field": "decision_spec_id",
      "current_identity": "NEE-120-QME-ECONOMIC-DECISION-V1",
      "proposed_identity": "NEE-120-QME-ECONOMIC-DECISION-V2",
      "proposed_identity_status": "OWNER_APPROVED_OPERATIONAL_ARTIFACT_NOT_CREATED"
    },
    {
      "ticket": "NEE-121",
      "current_path": "configs/governance/sample-holdout-v1.json",
      "current_sha256": "61d3c718:6ec3931a:1c053e33:e86aa63d:64065133:c2ebef6c:520c1a33:ade7c279",
      "proposed_v2_path": "configs/governance/sample-holdout-v2.json",
      "identity_field": "governance_contract_id",
      "current_identity": "NEE-121-SAMPLE-HOLDOUT-GOVERNANCE-V1",
      "proposed_identity": "NEE-121-SAMPLE-HOLDOUT-GOVERNANCE-V2",
      "proposed_identity_status": "OWNER_APPROVED_OPERATIONAL_ARTIFACT_NOT_CREATED"
    }
  ],
  "entries": [
    {
      "id": "S0A1-116-001",
      "ticket": "NEE-116",
      "source": {
        "type": "M0_REGISTRATION_POINTER",
        "path": "configs/governance/m0-registration-v1.json",
        "sha256": "fc61bb24:5e99c5a7:ac8de1ad:f909b785:2f3a651c:7925d0fb:63037db7:45946756",
        "json_pointer": "/mandates/review_and_accounting/reviewer_id"
      },
      "value": "neeljaiswal90",
      "disposition": "OUT_OF_SCOPE_WITH_EXACT_REASON",
      "status": "OUT_OF_SCOPE",
      "destination_json_pointers": [],
      "reason": "NEE-116 owns reviewer evidence; S0a-1 records but does not materialize self-review as independent review."
    },
    {
      "id": "S0A1-116-002",
      "ticket": "NEE-116",
      "source": {
        "type": "M0_REGISTRATION_POINTER",
        "path": "configs/governance/m0-registration-v1.json",
        "sha256": "fc61bb24:5e99c5a7:ac8de1ad:f909b785:2f3a651c:7925d0fb:63037db7:45946756",
        "json_pointer": "/mandates/review_and_accounting/reviewer_role"
      },
      "value": "OWNER_SELF_REVIEW_NOT_INDEPENDENT",
      "disposition": "OUT_OF_SCOPE_WITH_EXACT_REASON",
      "status": "OUT_OF_SCOPE",
      "destination_json_pointers": [],
      "reason": "NEE-116 owns reviewer-role evidence; the registered owner self-review is preserved without upgrading it."
    },
    {
      "id": "S0A1-116-003",
      "ticket": "NEE-116",
      "source": {
        "type": "M0_REGISTRATION_POINTER",
        "path": "configs/governance/m0-registration-v1.json",
        "sha256": "fc61bb24:5e99c5a7:ac8de1ad:f909b785:2f3a651c:7925d0fb:63037db7:45946756",
        "json_pointer": "/mandates/review_and_accounting/independent_human_review_claim_allowed"
      },
      "value": false,
      "disposition": "OUT_OF_SCOPE_WITH_EXACT_REASON",
      "status": "OUT_OF_SCOPE",
      "destination_json_pointers": [],
      "reason": "NEE-116 owns independent-review evidence; false is retained and no destination contract may imply otherwise."
    },
    {
      "id": "S0A1-116-004",
      "ticket": "NEE-116",
      "source": {
        "type": "M0_REGISTRATION_POINTER",
        "path": "configs/governance/m0-registration-v1.json",
        "sha256": "fc61bb24:5e99c5a7:ac8de1ad:f909b785:2f3a651c:7925d0fb:63037db7:45946756",
        "json_pointer": "/mandates/review_and_accounting/official_open_fallback"
      },
      "value": "NONE_FAIL_CLOSED",
      "disposition": "OUT_OF_SCOPE_WITH_EXACT_REASON",
      "status": "OUT_OF_SCOPE",
      "destination_json_pointers": [],
      "reason": "NEE-116 owns official review disposition; S0a-1 cannot create a fallback approval channel."
    },
    {
      "id": "S0A1-119-001",
      "ticket": "NEE-119",
      "source": {
        "type": "M0_REGISTRATION_POINTER",
        "path": "configs/governance/m0-registration-v1.json",
        "sha256": "fc61bb24:5e99c5a7:ac8de1ad:f909b785:2f3a651c:7925d0fb:63037db7:45946756",
        "json_pointer": "/mandates/quantitative_contract/minimum_rank_eligible_breadth"
      },
      "value": 150,
      "disposition": "MATERIALIZE_EXACT_VALUE",
      "status": "REGISTERED",
      "destination_json_pointers": [
        "/selection/minimum_rank_eligible_breadth/value"
      ],
      "reason": null
    },
    {
      "id": "S0A1-119-002",
      "ticket": "NEE-119",
      "source": {
        "type": "M0_REGISTRATION_POINTER",
        "path": "configs/governance/m0-registration-v1.json",
        "sha256": "fc61bb24:5e99c5a7:ac8de1ad:f909b785:2f3a651c:7925d0fb:63037db7:45946756",
        "json_pointer": "/mandates/quantitative_contract/minimum_selected_holdings"
      },
      "value": 30,
      "disposition": "MATERIALIZE_EXACT_VALUE",
      "status": "REGISTERED",
      "destination_json_pointers": [
        "/selection/minimum_selected_holdings"
      ],
      "reason": null
    },
    {
      "id": "S0A1-119-003",
      "ticket": "NEE-119",
      "source": {
        "type": "M0_REGISTRATION_POINTER",
        "path": "configs/governance/m0-registration-v1.json",
        "sha256": "fc61bb24:5e99c5a7:ac8de1ad:f909b785:2f3a651c:7925d0fb:63037db7:45946756",
        "json_pointer": "/mandates/quantitative_contract/selection_formula"
      },
      "value": "min(50, floor(20 * N_t / 100))",
      "disposition": "VALIDATE_EXISTING_EQUAL_VALUE",
      "status": "REGISTERED",
      "destination_json_pointers": [
        "/selection/formula"
      ],
      "reason": null
    },
    {
      "id": "S0A1-119-004",
      "ticket": "NEE-119",
      "source": {
        "type": "M0_REGISTRATION_POINTER",
        "path": "configs/governance/m0-registration-v1.json",
        "sha256": "fc61bb24:5e99c5a7:ac8de1ad:f909b785:2f3a651c:7925d0fb:63037db7:45946756",
        "json_pointer": "/mandates/quantitative_contract/breadth_boundary_proof"
      },
      "value": "floor(0.2 * 150) = 30",
      "disposition": "MATERIALIZE_EXACT_VALUE",
      "status": "REGISTERED",
      "destination_json_pointers": [
        "/selection/minimum_rank_eligible_breadth/boundary_proof"
      ],
      "reason": null
    },
    {
      "id": "S0A1-119-005",
      "ticket": "NEE-119",
      "source": {
        "type": "M0_REGISTRATION_POINTER",
        "path": "configs/governance/m0-registration-v1.json",
        "sha256": "fc61bb24:5e99c5a7:ac8de1ad:f909b785:2f3a651c:7925d0fb:63037db7:45946756",
        "json_pointer": "/mandates/quantitative_contract/universe_claim"
      },
      "value": "AV_SURVIVORSHIP_REDUCED_COMMON_STOCK_PROXY",
      "disposition": "VALIDATE_EXISTING_EQUAL_VALUE",